{
  "schema": "ev4-builder-responsive-input@0.1.0",
  "source_packet_ref": "packet:submitted-example:hybrid:sha256:111",
  "project_gate_ref": {
    "gate_id": "pg-001",
    "gate_status": "verified",
    "gate_hash": "sha256:aaaaaaaaaaaaaaaaaaaaaaaaaaaaaaaaaaaaaaaaaaaaaaaaaaaaaaaaaaaaaaaa"
  },
  "selected_candidate_id": "candidate-hybrid",
  "builder_output_ref": {
    "output_id": "builder-output-hybrid",
    "artifact_ref": "artifacts/builder/output.json",
    "artifact_hash": "sha256:bbbbbbbbbbbbbbbbbbbbbbbbbbbbbbbbbbbbbbbbbbbbbbbbbbbbbbbbbbbbbbbb"
  },
  "builder_evidence": {
    "action_batch_ref": "evidence/builder/action-batch.json",
    "execution_evidence_ref": "evidence/builder/execution.json",
    "layout_check_ref": "evidence/builder/layout-check.json",
    "completion_gate_ref": "evidence/builder/completion-gate.json"
  },
  "viewport_evidence": {
    "desktop": {
      "evidence_ref": "evidence/viewport/desktop.json",
      "evidence_status": "provided"
    },
    "tablet": {
      "evidence_ref": "evidence/viewport/tablet.json",
      "evidence_status": "provided"
    },
    "mobile": {
      "evidence_ref": "evidence/viewport/mobile.json",
      "evidence_status": "provided"
    }
  },
  "responsive_intake_decision": {
    "intake_allowed": true,
    "reason": "All required Builder and viewport evidence references are present for Responsive intake eligibility.",
    "claim_boundary": "input eligibility only; not responsive correctness evidence"
  },
  "forbidden_claims": [
    "production_ready",
    "release_ready",
    "pixel_perfect",
    "live_render_validated",
    "export_json_validated",
    "accessibility_passed",
    "responsive_correctness_validated",
    "ci_success_as_frontend_evidence"
  ],
  "decision_lineage": {
    "decision_family": "responsive_tree_architecture_route",
    "decision_card_ref": "kernel-decision-card:responsive-tree-architecture-route:v1",
    "selected_option": "hybrid_split_architecture",
    "rejected_options": [
      "same_tree_responsive_overrides",
      "viewport_specific_variant_tree",
      "blocked_pending_input"
    ],
    "evidence_refs": [
      "decision-evidence:architect-approved-candidate",
      "decision-evidence:builder-project-gate-package"
    ],
    "evidence_state": "validated",
    "consumer_stage": "responsive_intake"
  }
}
